{
  "version": 1,
  "reviewed_at": "2026-09-24",
  "reviewer": "Propietario del proyecto — autorización en conversación",
  "reviewer_type": "human",
  "method": "Revisión humana declarada por el propietario para estas diez preguntas P1: seis aprobadas sin cambio y cuatro aprobadas tras las correcciones literales indicadas. La aceptación se vincula al borrador corregido y a su evidencia mediante hashes; no atribuye carácter oficial.",
  "status": "reviewed",
  "sample_ids": [
    "AI-GSI-P1-B2-T02-001",
    "AI-GSI-P1-B2-T02-002",
    "AI-GSI-P1-B2-T02-003",
    "AI-GSI-P1-B2-T11-001",
    "AI-GSI-P1-B2-T11-002",
    "AI-GSI-P1-B3-T12-001",
    "AI-GSI-P1-B3-T12-002",
    "AI-GSI-P1-B3-T12-003",
    "AI-GSI-P1-B4-T09-001",
    "AI-GSI-P1-B4-T09-002"
  ],
  "reviews": [
    {"id": "AI-GSI-P1-B2-T02-001", "decision": "accepted", "record_sha256": "9142930b97274f7903efcb1d9fd6895c195d9e668ae6cb6d28ae6d45d14f0e2f", "evidence_sha256": "96c9354fc2f833261c5f6ba4349765c9e70ade50e7a99df8747beb4aca087c56", "method": "Aprobada sin cambios en conversación del 24/09/2026."},
    {"id": "AI-GSI-P1-B2-T02-002", "decision": "accepted", "record_sha256": "fa34e6ced4b2303f8415198cb3666a52f5b89bfb9fe49b0706e71a3e4062470d", "evidence_sha256": "96c9354fc2f833261c5f6ba4349765c9e70ade50e7a99df8747beb4aca087c56", "method": "Aprobada sin cambios en conversación del 24/09/2026."},
    {"id": "AI-GSI-P1-B2-T02-003", "decision": "accepted", "record_sha256": "c5003bbadb83e7f24ce7daf0eb0e37b4f96f04cc69b832bc6a9e831cae3cc77d", "evidence_sha256": "96c9354fc2f833261c5f6ba4349765c9e70ade50e7a99df8747beb4aca087c56", "method": "Aprobada tras corregir feedback.incorrect según conversación del 24/09/2026."},
    {"id": "AI-GSI-P1-B2-T11-001", "decision": "accepted", "record_sha256": "bd06257f4bd2218010c9e9922803718cd897d12670c0823169cfc059a53a0a18", "evidence_sha256": "5c31d9244d3a16cb2d67bed760cbad13c7304e6c3a589479c9d13ad382528497", "method": "Aprobada sin cambios en conversación del 24/09/2026."},
    {"id": "AI-GSI-P1-B2-T11-002", "decision": "accepted", "record_sha256": "336f034e20ebb4222ba9617cbe547a36a02f35c63b8b14af9c5c9fe828a586ba", "evidence_sha256": "eaf2ec59a192c16a30d3faa4d427b3c2e72a40f49cc71dcd525f1510d40c58e0", "method": "Aprobada tras corregir alternativas y feedback.correct según conversación del 24/09/2026."},
    {"id": "AI-GSI-P1-B3-T12-001", "decision": "accepted", "record_sha256": "9263fc47db3529ba556176e234f5920bee917fae3dffb67d4512511577c50109", "evidence_sha256": "d6bdb5158f27598f9707af311251c6f0688b46393e8492ff0a7dc35530fdc7e7", "method": "Aprobada sin cambios en conversación del 24/09/2026."},
    {"id": "AI-GSI-P1-B3-T12-002", "decision": "accepted", "record_sha256": "572277e90764bacb8f873812f286e0e5efae0b166e04605c765425040bddf11f", "evidence_sha256": "d6bdb5158f27598f9707af311251c6f0688b46393e8492ff0a7dc35530fdc7e7", "method": "Aprobada sin cambios en conversación del 24/09/2026."},
    {"id": "AI-GSI-P1-B3-T12-003", "decision": "accepted", "record_sha256": "a3e1036a2e058a0cb8a92c81fe4653898a0f5048cd205f8ae5be68312454f3d2", "evidence_sha256": "fa9f36d3be587b865ba33c93618b9b0ee28fa18023d6dcf4bcdb62dd76777a19", "method": "Aprobada tras corregir feedback.correct según conversación del 24/09/2026."},
    {"id": "AI-GSI-P1-B4-T09-001", "decision": "accepted", "record_sha256": "dfb718989956043dff2f79469783b640a88289fe6283461214c18aaa271a79b2", "evidence_sha256": "dbcb7f5f45a1e26e4a75553006f0f6776f8bdb2053b0699430636f2e3b5676b8", "method": "Aprobada tras corregir opción B y feedback.correct según conversación del 24/09/2026."},
    {"id": "AI-GSI-P1-B4-T09-002", "decision": "accepted", "record_sha256": "f3b0cefa3957fa8de64ddb4042d6a4e8f3b99956686252d089d9b7134e8f0f69", "evidence_sha256": "7f9f8737ba4aa5f82d27ed6f7dac05e63b86e9c3c7bac24cefe70b329230878c", "method": "Aprobada sin cambios en conversación del 24/09/2026."}
  ],
  "confirmation": {
    "received_at": "2026-09-24",
    "statement": "Las 10 preguntas han sido revisadas humanamente: 6 aprobadas sin cambios y 4 aprobadas con correcciones; las diez pueden activarse una vez aplicados los cambios.",
    "scope": "Diez preguntas IA P1 corregidas o conservadas de los cuatro temas",
    "record_count": 10,
    "records_sha256": "57f0d1e022458e0647a03be83f33a35c2d2e4a879a71dc48f24fe575f5253659"
  }
}
