{
  "version": 1,
  "reviewed_at": "2026-09-24",
  "reviewer": "Propietario del proyecto — autorización en conversación",
  "reviewer_type": "human",
  "method": "Revisión humana declarada por el propietario para dieciséis preguntas P2: trece aprobadas sin cambio de contenido y tres tras las correcciones literales indicadas. La aceptación se vincula al borrador corregido y a su evidencia mediante hashes; no atribuye carácter oficial.",
  "status": "reviewed",
  "sample_ids": [
    "AI-GSI-P2-B2-T01-001",
    "AI-GSI-P2-B2-T13-001",
    "AI-GSI-P2-B2-T13-002",
    "AI-GSI-P2-B2-T16-001",
    "AI-GSI-P2-B3-T01-001",
    "AI-GSI-P2-B3-T02-001",
    "AI-GSI-P2-B3-T02-002",
    "AI-GSI-P2-B3-T09-001",
    "AI-GSI-P2-B3-T13-001",
    "AI-GSI-P2-B3-T14-001",
    "AI-GSI-P2-B3-T14-002",
    "AI-GSI-P2-B4-T05-001",
    "AI-GSI-P2-B4-T07-001",
    "AI-GSI-P2-B4-T07-002",
    "AI-GSI-P2-B4-T10-001",
    "AI-GSI-P2-B4-T10-002"
  ],
  "reviews": [
    {
      "id": "AI-GSI-P2-B2-T01-001",
      "decision": "accepted",
      "record_sha256": "a0709ea12af8ca04a6d7711a4e18d239abb4d85ce064cc8d6958accca7e9c9fd",
      "evidence_sha256": "99a2a013cab21d9fe85eed3b2b1392d0aa1c50f1b68daeeccda632c8d35988b5",
      "method": "Aprobada sin cambios de contenido en conversación del 24/09/2026."
    },
    {
      "id": "AI-GSI-P2-B2-T13-001",
      "decision": "accepted",
      "record_sha256": "5baf9c9564d717c102823c7af438d2bb342fa1d048dbdc4afbaaed22c4e18244",
      "evidence_sha256": "91da4d1d8c537f428cc4dce5821fa0ffd824d238b0d2de7b566046674d3f7561",
      "method": "Aprobada sin cambios de contenido en conversación del 24/09/2026."
    },
    {
      "id": "AI-GSI-P2-B2-T13-002",
      "decision": "accepted",
      "record_sha256": "5e56f548aa6130bbd6c7a39b86b680c750da548521197c69aadd9f2eaac6c6fe",
      "evidence_sha256": "2cb54caf9871ab8b58d4e9c055bc10fbdff7f494ee29eecc40241af1d5bc5dd0",
      "method": "Aprobada sin cambios de contenido en conversación del 24/09/2026."
    },
    {
      "id": "AI-GSI-P2-B2-T16-001",
      "decision": "accepted",
      "record_sha256": "c8e613de9c50370ac9d41364608c77900dbefde2be23ded0f1f4d69a0bd0b7f7",
      "evidence_sha256": "8e2c07b144b65d73b9c96b5097ec1a5f9c1ffc182847e061aa88d48974e2c7ea",
      "method": "Aprobada sin cambios de contenido en conversación del 24/09/2026."
    },
    {
      "id": "AI-GSI-P2-B3-T01-001",
      "decision": "accepted",
      "record_sha256": "79fe69d25dc8dab4f2add29538f1247f4f8c343b3d2216bb38b2cd5309b5a0df",
      "evidence_sha256": "f929562174f7c887d97b250d913f4892258dcb6ac023279fb0ab2d28ad45c53a",
      "method": "Aprobada sin cambios de contenido en conversación del 24/09/2026."
    },
    {
      "id": "AI-GSI-P2-B3-T02-001",
      "decision": "accepted",
      "record_sha256": "d34432d7e5516fdff764a30a2a14bc977b240da17a20baeccb4c27660a09a119",
      "evidence_sha256": "6d61cae89c7a4908a46f745bb0c584d25bdcb7d025bd1aea92aba2d7bd82960c",
      "method": "Aprobada sin cambios de contenido en conversación del 24/09/2026."
    },
    {
      "id": "AI-GSI-P2-B3-T02-002",
      "decision": "accepted",
      "record_sha256": "5040596aa9f483ecdd257bdfae2387dde877398e295f6f3107d7653219a601ae",
      "evidence_sha256": "2ad4db53e6fde6a303394dc39def28f8a6c2f00b76f7b11fa09c324fe8e61e4e",
      "method": "Aprobada sin cambios de contenido en conversación del 24/09/2026."
    },
    {
      "id": "AI-GSI-P2-B3-T09-001",
      "decision": "accepted",
      "record_sha256": "1b1ab40870b3cdb6ddc30de24b86ed0842a80f22457a29b18ae580fa3792b9e3",
      "evidence_sha256": "d3ba959959ae45fbc0f4ad2f00519a6d86fdbd388cfb1ada22636f0c375d9110",
      "method": "Aprobada tras corregir opción D y feedback.correct, y reescribir A-C con autorización en conversación del 24/09/2026."
    },
    {
      "id": "AI-GSI-P2-B3-T13-001",
      "decision": "accepted",
      "record_sha256": "41d29a7c2b8f463d5b4beb0d6527ee82272e0efa603058798fc5360bcc7aa606",
      "evidence_sha256": "9a06975af61b348ef37a0f0ad36c70c1996825ab1e852461d239bc29a2d6f1dd",
      "method": "Aprobada tras corregir feedback.correct según conversación del 24/09/2026."
    },
    {
      "id": "AI-GSI-P2-B3-T14-001",
      "decision": "accepted",
      "record_sha256": "5339a6b3e028f08ec6ed60d2f1f325bd7cb0ff58fec8d315a23553d521e415bc",
      "evidence_sha256": "0522e9f01ebcf21c90648384821d354a9453c97e271b83481bb9f4eb93acc0dd",
      "method": "Aprobada sin cambios de contenido en conversación del 24/09/2026."
    },
    {
      "id": "AI-GSI-P2-B3-T14-002",
      "decision": "accepted",
      "record_sha256": "90f30c0db4e62c8ce5869baaa82107949dbbbf983e34b77ab6d0c2c96a1cd2f1",
      "evidence_sha256": "0522e9f01ebcf21c90648384821d354a9453c97e271b83481bb9f4eb93acc0dd",
      "method": "Aprobada sin cambios de contenido en conversación del 24/09/2026."
    },
    {
      "id": "AI-GSI-P2-B4-T05-001",
      "decision": "accepted",
      "record_sha256": "af0501c93d7021885ccb6d9fbfc099b44512c1539e2508d404413566c92d974f",
      "evidence_sha256": "63a9f5fb212f13703df2fb802b88b3303e760b581f1fc2ab42b462fb6a131d90",
      "method": "Aprobada sin cambios de contenido en conversación del 24/09/2026."
    },
    {
      "id": "AI-GSI-P2-B4-T07-001",
      "decision": "accepted",
      "record_sha256": "a85faf0575d9bed8d7cf112bb04607ee245ba78b1d0512eb5e09a4ea5cc75e64",
      "evidence_sha256": "17cd5d6f3c0ea4b8bf598f082581e322e378578fb3d9cb11888984256e3bfb44",
      "method": "Aprobada sin cambios de contenido en conversación del 24/09/2026."
    },
    {
      "id": "AI-GSI-P2-B4-T07-002",
      "decision": "accepted",
      "record_sha256": "75d742adda561d1a4aad2bf0bcf0aee4e1c22702c3ad3c66b3b65974fee00def",
      "evidence_sha256": "17cd5d6f3c0ea4b8bf598f082581e322e378578fb3d9cb11888984256e3bfb44",
      "method": "Aprobada sin cambios de contenido en conversación del 24/09/2026."
    },
    {
      "id": "AI-GSI-P2-B4-T10-001",
      "decision": "accepted",
      "record_sha256": "b1327f3f24f48785e85d0d12439c05173339b3e0af3c00e14c418abd3787d775",
      "evidence_sha256": "bab01a5be149e30dc8f09ee8ad8d15b1f28d2946c7eedaf873e99f1e49b11ce8",
      "method": "Aprobada sin cambios de contenido en conversación del 24/09/2026."
    },
    {
      "id": "AI-GSI-P2-B4-T10-002",
      "decision": "accepted",
      "record_sha256": "3cfce52be3fa2570d2b140fc9642315db2ff8afb400c3314acc467483b814e5f",
      "evidence_sha256": "c4f9417bcb66b6016b9d04d6cf8d7995e74b63fde7a661dbc562a4c34886ece2",
      "method": "Aprobada tras corregir feedback.correct según conversación del 24/09/2026."
    }
  ],
  "confirmation": {
    "received_at": "2026-09-24",
    "statement": "Las 16 preguntas P2 han sido revisadas humanamente: 13 aprobadas sin cambios y 3 aprobadas con correcciones; las dieciséis pueden activarse una vez aplicados los cambios.",
    "scope": "Dieciséis preguntas IA P2 corregidas o conservadas de once temas",
    "record_count": 16,
    "records_sha256": "35fcfac32cfeb0c9464ddd224211b4758c0cb553b010aff7e57df46096c75a0a"
  }
}
